{
  "$schema": "../../docs/status.schema.json",
  "schemaVersion": 2,
  "name": "microsoft-teams",
  "package": "@mindstone/mcp-server-microsoft-teams",
  "auth": {
    "type": "oauth-host-orchestrated",
    "envVars": [
      "MS_CLIENT_ID"
    ]
  },
  "tools": {
    "count": 14,
    "domains": [
      "chats",
      "messages",
      "teams",
      "channels",
      "users",
      "search",
      "presence"
    ]
  },
  "surface": "cloud-api",
  "evidence": {
    "changelog": "./CHANGELOG.md",
    "tools": "./src/tools.ts",
    "auth": "./src/utils.ts",
    "tests": "./test/",
    "serverJson": "./server.json"
  }
}
