{
  "$schema": "../../docs/status.schema.json",
  "schemaVersion": 2,
  "name": "google-workspace",
  "package": "@mindstone/mcp-server-google-workspace",
  "auth": {
    "type": "oauth-host-orchestrated",
    "envVars": [
      "GOOGLE_CLIENT_ID",
      "GOOGLE_CLIENT_SECRET",
      "ACCOUNTS_PATH",
      "CREDENTIALS_PATH"
    ]
  },
  "tools": {
    "count": 120,
    "domains": [
      "gmail",
      "calendar",
      "drive",
      "docs",
      "sheets",
      "slides",
      "contacts",
      "chat",
      "meet",
      "comments",
      "account",
      "tasks",
      "forms"
    ]
  },
  "surface": "cloud-api",
  "evidence": {
    "changelog": "./CHANGELOG.md",
    "tools": "./src/tools/",
    "auth": "./src/modules/accounts/",
    "tests": "./test/",
    "serverJson": "./server.json"
  }
}
