{
  "$schema": "../../docs/status.schema.json",
  "schemaVersion": 2,
  "name": "microsoft-mail",
  "package": "@mindstone/mcp-server-microsoft-mail",
  "auth": {
    "type": "oauth-host-orchestrated",
    "envVars": [
      "MS_CLIENT_ID"
    ]
  },
  "tools": {
    "count": 22,
    "domains": [
      "messages",
      "folders",
      "drafts",
      "attachments",
      "conversations",
      "settings"
    ]
  },
  "surface": "cloud-api",
  "evidence": {
    "changelog": "./CHANGELOG.md",
    "tools": "./src/tools.ts",
    "auth": "./src/utils.ts",
    "tests": "./test/",
    "serverJson": "./server.json"
  }
}
