{
  "$schema": "../../docs/status.schema.json",
  "schemaVersion": 2,
  "name": "servicenow",
  "package": "@mindstone/mcp-server-servicenow",
  "auth": {
    "type": "basic-auth",
    "envVars": [
      "SERVICENOW_PASSWORD"
    ]
  },
  "tools": {
    "count": 10,
    "domains": [
      "incidents",
      "change-requests",
      "users",
      "knowledge"
    ]
  },
  "surface": "cloud-api",
  "evidence": {
    "changelog": "./CHANGELOG.md",
    "tools": "./src/tools/",
    "auth": "./src/",
    "tests": "./test/",
    "npm": "https://www.npmjs.com/package/@mindstone/mcp-server-servicenow",
    "serverJson": "./server.json"
  }
}
