{
  "$schema": "../../docs/status.schema.json",
  "schemaVersion": 2,
  "name": "office",
  "package": "@mindstone/mcp-server-office",
  "auth": {
    "type": "none",
    "envVars": []
  },
  "tools": {
    "count": 55,
    "domains": [
      "word",
      "excel",
      "powerpoint",
      "setup"
    ]
  },
  "surface": "desktop-addin",
  "evidence": {
    "changelog": "./CHANGELOG.md",
    "tools": "./src/",
    "auth": "./src/",
    "npm": "https://www.npmjs.com/package/@mindstone/mcp-server-office",
    "serverJson": "./server.json"
  }
}
