{
  "$schema": "../../docs/status.schema.json",
  "schemaVersion": 2,
  "name": "quickbooks",
  "package": "@mindstone/mcp-server-quickbooks",
  "auth": {
    "type": "oauth",
    "envVars": [
      "QUICKBOOKS_CLIENT_SECRET",
      "QUICKBOOKS_REFRESH_TOKEN"
    ]
  },
  "tools": {
    "count": 21,
    "domains": [
      "customers",
      "vendors",
      "invoices",
      "bills",
      "estimates",
      "reports"
    ]
  },
  "surface": "cloud-api",
  "evidence": {
    "changelog": "./CHANGELOG.md",
    "tools": "./src/tools/",
    "auth": "./src/",
    "tests": "./test/",
    "npm": "https://www.npmjs.com/package/@mindstone/mcp-server-quickbooks",
    "serverJson": "./server.json"
  }
}
