{
  "$schema": "../../docs/status.schema.json",
  "schemaVersion": 2,
  "name": "salesforce",
  "package": "@mindstone/mcp-server-salesforce",
  "auth": {
    "type": "oauth-local-callback",
    "envVars": [
      "SALESFORCE_CLIENT_SECRET",
      "SALESFORCE_ACCESS_TOKEN"
    ]
  },
  "tools": {
    "count": 32,
    "domains": [
      "accounts",
      "contacts",
      "opportunities",
      "leads",
      "tasks",
      "cases",
      "events",
      "search",
      "query"
    ]
  },
  "surface": "cloud-api",
  "evidence": {
    "changelog": "./CHANGELOG.md",
    "tools": "./src/tools/",
    "auth": "./src/",
    "tests": "./test/",
    "npm": "https://www.npmjs.com/package/@mindstone/mcp-server-salesforce",
    "serverJson": "./server.json"
  }
}
