{
  "$schema": "../../docs/status.schema.json",
  "schemaVersion": 2,
  "name": "napkin",
  "package": "@mindstone/mcp-server-napkin",
  "auth": {
    "type": "api-key",
    "envVars": [
      "NAPKIN_API_KEY"
    ]
  },
  "tools": {
    "count": 5,
    "domains": [
      "visuals",
      "downloads",
      "styles"
    ]
  },
  "surface": "cloud-api",
  "evidence": {
    "changelog": "./CHANGELOG.md",
    "tools": "./src/tools/",
    "auth": "./src/",
    "tests": "./test/",
    "npm": "https://www.npmjs.com/package/@mindstone/mcp-server-napkin",
    "serverJson": "./server.json"
  }
}
