{
  "$schema": "../../docs/status.schema.json",
  "schemaVersion": 2,
  "name": "microsoft-calendar",
  "package": "@mindstone/mcp-server-microsoft-calendar",
  "auth": {
    "type": "oauth-host-orchestrated",
    "envVars": [
      "MS_CLIENT_ID"
    ]
  },
  "tools": {
    "count": 10,
    "domains": [
      "events",
      "calendars",
      "free-busy",
      "scheduling"
    ]
  },
  "surface": "cloud-api",
  "evidence": {
    "changelog": "./CHANGELOG.md",
    "tools": "./src/tools.ts",
    "auth": "./src/utils.ts",
    "tests": "./test/",
    "serverJson": "./server.json"
  }
}
