{
  "$schema": "../../docs/status.schema.json",
  "schemaVersion": 2,
  "name": "microsoft-files",
  "package": "@mindstone/mcp-server-microsoft-files",
  "auth": {
    "type": "oauth-host-orchestrated",
    "envVars": [
      "MS_CLIENT_ID"
    ]
  },
  "tools": {
    "count": 20,
    "domains": [
      "files",
      "folders",
      "sharing",
      "permissions",
      "versions",
      "activity"
    ]
  },
  "surface": "cloud-api",
  "evidence": {
    "changelog": "./CHANGELOG.md",
    "tools": "./src/tools.ts",
    "auth": "./src/utils.ts",
    "tests": "./test/",
    "serverJson": "./server.json"
  }
}
