{
  "$schema": "../../docs/status.schema.json",
  "schemaVersion": 2,
  "name": "kling",
  "package": "@mindstone/mcp-server-kling",
  "auth": {
    "type": "api-key",
    "envVars": [
      "KLING_ACCESS_KEY",
      "KLING_SECRET_KEY"
    ]
  },
  "tools": {
    "count": 4,
    "domains": [
      "video-generation",
      "tasks"
    ]
  },
  "surface": "cloud-api",
  "evidence": {
    "changelog": "./CHANGELOG.md",
    "tools": "./src/tools/",
    "auth": "./src/",
    "tests": "./test/",
    "npm": "https://www.npmjs.com/package/@mindstone/mcp-server-kling",
    "serverJson": "./server.json"
  }
}
