{
  "$schema": "../../docs/status.schema.json",
  "schemaVersion": 2,
  "name": "wise",
  "package": "@mindstone/mcp-server-wise",
  "auth": {
    "type": "api-key",
    "envVars": [
      "WISE_API_TOKEN"
    ]
  },
  "tools": {
    "count": 17,
    "domains": [
      "accounts",
      "balances",
      "recipients",
      "quotes",
      "transfers",
      "discovery"
    ]
  },
  "surface": "cloud-api",
  "evidence": {
    "changelog": "./CHANGELOG.md",
    "tools": "./src/tools/",
    "auth": "./src/",
    "tests": "./test/",
    "npm": "https://www.npmjs.com/package/@mindstone/mcp-server-wise",
    "serverJson": "./server.json"
  }
}
