{
  "$schema": "../../docs/status.schema.json",
  "schemaVersion": 2,
  "name": "replit-ssh",
  "package": "@mindstone/mcp-server-replit-ssh",
  "auth": {
    "type": "none",
    "envVars": []
  },
  "tools": {
    "count": 9,
    "domains": [
      "connection",
      "files",
      "ssh-setup"
    ]
  },
  "surface": "local-protocol",
  "evidence": {
    "changelog": "./CHANGELOG.md",
    "tools": "./src/server.ts",
    "auth": "./src/ssh.ts",
    "tests": "./test/",
    "npm": "https://www.npmjs.com/package/@mindstone/mcp-server-replit-ssh",
    "serverJson": "./server.json"
  }
}
