{
  "$schema": "../../docs/status.schema.json",
  "schemaVersion": 2,
  "name": "humaans",
  "package": "@mindstone/mcp-server-humaans",
  "auth": {
    "type": "api-key",
    "envVars": [
      "HUMAANS_API_KEY"
    ]
  },
  "tools": {
    "count": 16,
    "domains": [
      "people",
      "job-roles",
      "time-away",
      "company",
      "teams"
    ]
  },
  "surface": "cloud-api",
  "evidence": {
    "changelog": "./CHANGELOG.md",
    "tools": "./src/tools/",
    "auth": "./src/",
    "tests": "./test/",
    "npm": "https://www.npmjs.com/package/@mindstone/mcp-server-humaans",
    "serverJson": "./server.json"
  }
}
