{
  "$schema": "../../docs/status.schema.json",
  "schemaVersion": 2,
  "name": "microsoft-sharepoint",
  "package": "@mindstone/mcp-server-microsoft-sharepoint",
  "auth": {
    "type": "oauth-host-orchestrated",
    "envVars": [
      "MS_CLIENT_ID"
    ]
  },
  "tools": {
    "count": 39,
    "domains": [
      "sharepoint-sites",
      "document-libraries",
      "pages",
      "lists",
      "metadata",
      "search"
    ]
  },
  "surface": "cloud-api",
  "evidence": {
    "changelog": "./CHANGELOG.md",
    "tools": "./src/tools.ts",
    "auth": "./src/utils.ts",
    "tests": "./test/",
    "serverJson": "./server.json"
  }
}
