{
  "$schema": "../../docs/status.schema.json",
  "schemaVersion": 2,
  "name": "mixmax",
  "package": "@mindstone/mcp-server-mixmax",
  "auth": {
    "type": "api-key",
    "envVars": [
      "MIXMAX_API_TOKEN"
    ]
  },
  "tools": {
    "count": 10,
    "domains": [
      "sequences",
      "messages",
      "snippets",
      "meetings"
    ]
  },
  "surface": "cloud-api",
  "evidence": {
    "changelog": "./CHANGELOG.md",
    "tools": "./src/tools/",
    "auth": "./src/",
    "tests": "./test/",
    "npm": "https://www.npmjs.com/package/@mindstone/mcp-server-mixmax",
    "serverJson": "./server.json"
  }
}
