{
  "$schema": "../../docs/status.schema.json",
  "schemaVersion": 2,
  "name": "slack",
  "package": "@mindstone/mcp-server-slack",
  "auth": {
    "type": "oauth-host-orchestrated",
    "envVars": [
      "SLACK_CLIENT_SECRET"
    ]
  },
  "tools": {
    "count": 23,
    "domains": [
      "messages",
      "channels",
      "threads",
      "users",
      "files"
    ]
  },
  "surface": "cloud-api",
  "evidence": {
    "changelog": "./CHANGELOG.md",
    "tools": "./src/tools/",
    "auth": "./src/",
    "tests": "./test/",
    "npm": "https://www.npmjs.com/package/@mindstone/mcp-server-slack",
    "serverJson": "./server.json"
  }
}
