{
  "$schema": "../../docs/status.schema.json",
  "schemaVersion": 2,
  "name": "runway",
  "package": "@mindstone/mcp-server-runway",
  "auth": {
    "type": "api-key",
    "envVars": [
      "RUNWAYML_API_SECRET"
    ]
  },
  "tools": {
    "count": 22,
    "domains": [
      "video",
      "image",
      "audio",
      "voices",
      "tasks"
    ]
  },
  "surface": "cloud-api",
  "evidence": {
    "changelog": "./CHANGELOG.md",
    "tools": "./src/tools/",
    "auth": "./src/",
    "tests": "./test/",
    "npm": "https://www.npmjs.com/package/@mindstone/mcp-server-runway",
    "serverJson": "./server.json"
  }
}
