{
  "$schema": "../../docs/status.schema.json",
  "schemaVersion": 2,
  "name": "pandadoc",
  "package": "@mindstone/mcp-server-pandadoc",
  "auth": {
    "type": "api-key",
    "envVars": [
      "PANDADOC_API_KEY"
    ]
  },
  "tools": {
    "count": 9,
    "domains": [
      "documents",
      "templates"
    ]
  },
  "surface": "cloud-api",
  "evidence": {
    "changelog": "./CHANGELOG.md",
    "tools": "./src/tools/",
    "auth": "./src/",
    "tests": "./test/",
    "npm": "https://www.npmjs.com/package/@mindstone/mcp-server-pandadoc",
    "serverJson": "./server.json"
  }
}
