{
  "$schema": "../../docs/status.schema.json",
  "schemaVersion": 2,
  "name": "google-analytics",
  "package": "@mindstone/mcp-server-google-analytics",
  "auth": {
    "type": "oauth",
    "envVars": []
  },
  "tools": {
    "count": 34,
    "domains": [
      "accounts",
      "schema",
      "reporting",
      "admin"
    ]
  },
  "surface": "cloud-api",
  "evidence": {
    "changelog": "./CHANGELOG.md",
    "tools": "./src/tools/",
    "auth": "./src/",
    "tests": "./test/",
    "npm": "https://www.npmjs.com/package/@mindstone/mcp-server-google-analytics",
    "serverJson": "./server.json"
  }
}
