{
  "$schema": "../../docs/status.schema.json",
  "schemaVersion": 2,
  "name": "browserbase",
  "package": "@mindstone/mcp-server-browserbase",
  "auth": {
    "type": "api-key",
    "envVars": [
      "BROWSERBASE_API_KEY"
    ]
  },
  "tools": {
    "count": 53,
    "domains": [
      "projects",
      "sessions",
      "contexts",
      "agents",
      "agent-runs",
      "downloads",
      "extensions",
      "certificates",
      "fetch-search",
      "functions"
    ]
  },
  "surface": "cloud-api",
  "evidence": {
    "changelog": "./CHANGELOG.md",
    "tools": "./src/tools/",
    "auth": "./src/",
    "tests": "./test/",
    "npm": "https://www.npmjs.com/package/@mindstone/mcp-server-browserbase",
    "serverJson": "./server.json"
  }
}
