{
  "$schema": "../../docs/status.schema.json",
  "schemaVersion": 2,
  "name": "computers",
  "package": "@mindstone/mcp-server-computers",
  "auth": {
    "type": "api-key",
    "envVars": [
      "FLY_API_TOKEN",
      "E2B_API_KEY",
      "GOOGLE_CLOUD_KEY"
    ]
  },
  "tools": {
    "count": 14,
    "domains": [
      "computers",
      "commands",
      "browser",
      "files"
    ]
  },
  "surface": "cloud-api",
  "evidence": {
    "changelog": "./CHANGELOG.md",
    "tools": "./src/",
    "auth": "./src/",
    "tests": "./test/",
    "npm": "https://www.npmjs.com/package/@mindstone/mcp-server-computers",
    "serverJson": "./server.json"
  }
}
